A1: ID# | B1: Portfolio Name | C1: YTD Return
A2: P16 | B2: Vanguard Windsor | C2: 3.1%
A3: P21 | B3: Scott Burns’ Six Ways from Sunday Portfolio | C3: 2.2%
A4: P19 | B4: Scott Burns’ Four Square Portfolio | C4: 1.6%
A5: P13 | B5: David Swensen’s Lazy Portfolio | C5: 1.5%
A6: P20 | B6: Scott Burns’ Five Fold Portfolio | C6: 1.3%
A7: P5 | B7: Taylor Larimore 4 Fund | C7: 1.3%
A8: P4 | B8: Taylor Larimore 3 Fund | C8: 1.3%
A9: P8 | B9: William Bernstein’s Basic No-Brainer Portfolio | C9: 1.2%
A10: P6 | B10: Rick Ferri Core Four | C10: 1.1%
A11: P14 | B11: David Swensen’s Yale Endowment | C11: 1.1%
A12: P17 | B12: Scott Burns’ Couch Potato Portfolio | C12: 1.1%
A13: P11 | B13: Bill Schultheis’ Coffeehouse Portfolio Vanguard | C13: 1.0%
A14: P7 | B14: William Bernstein’s No Brainer Cowards Portfolio | C14: 1.0%
A15: P18 | B15: Scott Burns’ Margarita Portfolio | C15: 1.0%
A16: P12 | B16: FundAdvice Ultimate Buy & Hold | C16: 0.9%
A17: P15 | B17: MMM Do It Yourself Funds | C17: 0.8%
A18: P22 | B18: Larry Swedroe Simple | C18: 0.7%
A19: P10 | B19: Ted Aronson’s Lazy Portfolio | C19: 0.2%
A20: P23 | B20: Larry Swedroe Min Fat Tails | C20: -0.3%
A21: P9 | B21: Dilbert World’s Simplest | C21: -0.3%
A22: P3 | B22: Permanent Portfolio Fund (PRPFX) | C22: -0.7%
A23: P1 | B23: Harry Browne Permanent Portfolio (ETF) | C23: -1.8%
A24: P2 | B24: Paul Boyer Permanent Portfolio (ETF) | C24: -2.7%

A1: ID | B1: FUND NAME | C1: TICKER | D1: %
A2: P1 | B2: Harry Browne Permanent Portfolio
B3: Vanguard Total Stock Market ETF | C3: VTI | D3: 25%
B4: iShares Barclays 20+ Year Treas Bond | C4: TLT | D4: 25%
B5: iShares Barclays 1-3 Year Treasury Bond | C5: SHY | D5: 25%
B6: iShares Gold Trust | C6: IAU | D6: 25%
A8: P2 | B8: Paul Boyer Permanent Portfolio
B9: Vanguard Small Cap Value Index | C9: VBR | D9: 12.5%
B10: Vanguard Emerging Mkts Stock Idx | C10: VWO | D10: 12.5%
B11: iShares Barclays 20+ Year Treas Bond | C11: TLT | D11: 25%
B12: iShares Barclays 1-3 Year Treasury Bond | C12: SHY | D12: 25%
B13: iShares Gold Trust | C13: IAU | D13: 25%
A16: P3 | B16: Permanent Portfolio Fund | C16: PRPFX | D16: 100%
A19: P4 | B19: Taylor Larimore 3 Fund
B20: Vanguard Total Stock Mkt Idx | C20: VTSMX | D20: 40%
B21: Vanguard Total Intl Stock Index | C21: VGTSX | D21: 20%
B22: Vanguard Total Bond Market Index | C22: VBMFX | D22: 40%
C23: TOTAL | D23: 100%
A25: P5 | B25: Taylor Larimore 4 Fund (NOT VALID)
B26: Vanguard Total Stock Mkt Idx | C26: VTSMX | D26: 50%
B27: Vanguard Total Intl Stock Index | C27: VGTSX | D27: 30%
B28: Vanguard Total Bond Market Index | C28: VBMFX | D28: 10%
B29: Vanguard Inflation-Protected Secs | C29: VIPSX | D29: 10%
C30: TOTAL | D30: 100%
A32: P6 | B32: Rick Ferri Core Four
B33: Vanguard Total Stock Mkt Idx | C33: VTSMX | D33: 35%
B34: Vanguard REIT Index | C34: VGSIX | D34: 10%
B35: Vanguard Total Intl Stock Index | C35: VGTSX | D35: 15%
B36: Vanguard Total Bond Market Index | C36: VBMFX | D36: 40%
C37: TOTAL | D37: 100%
A39: P7 | B39: William Bernstein’s No Brainer Cowards Portfolio
B40: Vanguard Short-Term Investment-Grade | C40: VFSTX | D40: 40%
B41: Vanguard Total Stock Mkt Idx | C41: VTSMX | D41: 15%
B42: Vanguard Small Cap Value Index | C42: VISVX | D42: 10%
B43: Vanguard Value Index | C43: VIVAX | D43: 10%
B44: Vanguard Emerging Mkts Stock Idx | C44: VEIEX | D44: 5%
B45: Vanguard European Stock Index | C45: VEURX | D45: 5%
B46: Vanguard Pacific Stock Index | C46: VPACX | D46: 5%
B47: Vanguard REIT Index | C47: VGSIX | D47: 5%
B48: Vanguard Tax-Managed Small Cap Inv | C48: VTMSX | D48: 5%
C49: TOTAL | D49: 100%
A51: P8 | B51: William Bernstein’s Basic No-Brainer Portfolio
B52: Vanguard 500 Index | C52: VFINX | D52: 25%
B53: Vanguard Tax-Managed Small Cap Inv | C53: VTMSX | D53: 25%
B54: Vanguard Tax-Managed Intl | C54: VTMGX | D54: 25%
B55: Vanguard Short-Term Bond Index | C55: VBISX | D55: 25%
C56: TOTAL | D56: 100%
A58: P9 | B58: Dilbert World’s Simplest
B59: Vanguard Total Stock Mkt Idx | C59: VTSMX | D59: 50%
B60: Vanguard Emerging Mkts Stock Idx | C60: VEIEX | D60: 50%
B61: dilbert.com/blog/entry/worlds_simplest_portfolio | C61: TOTAL | D61: 100%
A63: P10 | B63: Ted Aronson’s Lazy Portfolio
B64: Vanguard Emerging Mkts Stock Idx | C64: VEIEX | D64: 20%
B65: Vanguard 500 Index | C65: VFINX | D65: 15%
B66: Vanguard Pacific Stock Index | C66: VPACX | D66: 15%
B67: Vanguard Extended Market Idx | C67: VEXMX | D67: 10%
B68: Vanguard Inflation-Protected Secs | C68: VIPSX | D68: 10%
B69: Vanguard European Stock Index | C69: VEURX | D69: 5%
B70: Vanguard High-Yield Corporate | C70: VWEHX | D70: 5%
B71: Vanguard Long-Term U.S. Treasury | C71: VUSTX | D71: 5%
B72: Vanguard Small Cap Growth Index | C72: VISGX | D72: 5%
B73: Vanguard Small Cap Value Index | C73: VISVX | D73: 5%
B74: Vanguard Total Stock Mkt Idx | C74: VTSMX | D74: 5%
C75: TOTAL | D75: 100%
A77: P11 | B77: Bill Schultheis’ Coffeehouse Portfolio Vanguard
B78: Vanguard Total Bond Market Index | C78: VBMFX | D78: 40%
B79: Vanguard 500 Index | C79: VFINX | D79: 10%
B80: Vanguard Value Index | C80: VIVAX | D80: 10%
B81: Vanguard Total Intl Stock Index | C81: VGTSX | D81: 10%
B82: Vanguard REIT Index | C82: VGSIX | D82: 10%
B83: Vanguard Small Cap Value Index | C83: VISVX | D83: 10%
B84: Vanguard Small Cap Index | C84: NAESX | D84: 10%
C85: TOTAL | D85: 100%
A87: P12 | B87: FundAdvice Ultimate Buy & Hold
B88: Vanguard 500 Index | C88: VFINX | D88: 6%
B89: Vanguard Value Index | C89: VIVAX | D89: 6%
B90: Vanguard Small Cap Index | C90: NAESX | D90: 6%
B91: Vanguard Small Cap Value Index | C91: VISVX | D91: 6%
B92: Vanguard REIT Index | C92: VGSIX | D92: 6%
B93: Vanguard Developed Markets Index | C93: VDMIX | D93: 12%
B94: Vanguard Inflation-Protected Secs | C94: VIPSX | D94: 8%
B95: Vanguard Interm-Term U.S. Treas | C95: VFITX | D95: 20%
B96: Vanguard Short-Term Treasury | C96: VFISX | D96: 12%
B97: Vanguard International Value | C97: VTRIX | D97: 12%
B98: Vanguard Emerging Mkts Stock Idx | C98: VEIEX | D98: 6%
C99: TOTAL | D99: 100%
A101: P13 | B101: David Swensen’s Lazy Portfolio
B102: Vanguard Total Stock Mkt Idx | C102: VTSMX | D102: 30%
B103: Vanguard REIT Index | C103: VGSIX | D103: 20%
B104: Vanguard Developed Markets Index | C104: VDMIX | D104: 15%
B105: Vanguard Emerging Mkts Stock Idx | C105: VEIEX | D105: 5%
B106: Vanguard Inflation-Protected Secs | C106: VIPSX | D106: 15%
B107: Vanguard Short-Term Treasury | C107: VFISX | D107: 15%
C108: TOTAL | D108: 100%
A110: P14 | B110: David Swensen’s Yale Endowment
B111: Vanguard Total Stock Mkt Idx | C111: VTSMX | D111: 30%
B112: Vanguard REIT Index | C112: VGSIX | D112: 20%
B113: Vanguard Developed Markets Index | C113: VDMIX | D113: 15%
B114: Vanguard Emerging Mkts Stock Idx | C114: VEIEX | D114: 5%
B115: Vanguard Inflation-Protected Secs | C115: VIPSX | D115: 15%
B116: Vanguard Long-Term Treasury Investor | C116: VUSTX | D116: 15%
C117: TOTAL | D117: 100%
A119: P15 | B119: MMM Do It Yourself Funds
B120: Vanguard 500 Index | C120: VFINX | D120: 12%
B121: Vanguard Value Index | C121: VIVAX | D121: 12%
B122: Vanguard Small Cap Value Index | C122: VISVX | D122: 20%
B123: Bridgeway Ultra-Small Company Market | C123: BRSIX | D123: 20%
B124: Vanguard REIT Index | C124: VGSIX | D124: 5%
B125: Vanguard International Value | C125: VTRIX | D125: 9%
B126: Vanguard International Explorer | C126: VGTSX | D126: 9%
B127: Vanguard Emerging Mkts Stock Idx | C127: VEIEX | D127: 13%
C128: TOTAL | D128: 100%
A130: P16 | B130: Vanguard Windsor | C130: VWNDX | D130: 100%
A132: P17 | B132: Scott Burns’ Couch Potato Portfolio
B133: Vanguard Total Stock Mkt Idx | C133: VTSMX | D133: 50%
B134: Vanguard Inflation-Protected Secs | C134: VIPSX | D134: 50%
C135: TOTAL | D135: 100%
A137: P18 | B137: Scott Burns’ Margarita Portfolio
B138: Vanguard Total Stock Mkt Idx | C138: VTSMX | D138: 33%
B139: Vanguard Inflation-Protected Secs | C139: VIPSX | D139: 33%
B140: Vanguard Total Intl Stock Index | C140: VGTSX | D140: 33%
C141: TOTAL | D141: 100%
A143: P19 | B143: Scott Burns’ Four Square Portfolio
B144: Vanguard Total Stock Mkt Idx | C144: VTSMX | D144: 25%
B145: Vanguard Inflation-Protected Secs | C145: VIPSX | D145: 25%
B146: Vanguard Total Intl Stock Index | C146: VGTSX | D146: 25%
B147: Vanguard REIT Index | C147: VGSIX | D147: 25%
C148: TOTAL | D148: 100%
A150: P20 | B150: Scott Burns’ Five Fold Portfolio
B151: Vanguard Total Stock Mkt Idx | C151: VTSMX | D151: 20%
B152: Vanguard Inflation-Protected Secs | C152: VIPSX | D152: 20%
B153: Vanguard Total Intl Stock Index | C153: VGTSX | D153: 20%
B154: Vanguard REIT Index | C154: VGSIX | D154: 20%
B155: American Century International Bd Inv | C155: BEGBX | D155: 20%
C156: TOTAL | D156: 100%
A158: P21 | B158: Scott Burns’ Six Ways from Sunday Portfolio
B159: Vanguard Total Stock Mkt Idx | C159: VTSMX | D159: 16.7%
B160: Vanguard Inflation-Protected Secs | C160: VIPSX | D160: 16.7%
B161: Vanguard Total Intl Stock Index | C161: VGTSX | D161: 16.7%
B162: Vanguard REIT Index | C162: VGSIX | D162: 16.7%
B163: American Century International Bd Inv | C163: BEGBX | D163: 16.7%
B164: Vanguard Energy | C164: VGENX | D164: 16.7%
C165: TOTAL | D165: 100.0%
A167: P22 | B167: Larry Swedroe Simple
B168: Vanguard Value Index | C168: VIVAX | D168: 15%
B169: Vanguard Small Cap Value Index | C169: VISVX | D169: 15%
B170: Vanguard Small Cap Index | C170: NAESX | D170: 13%
B171: Vanguard Emerging Mkts Stock Idx | C171: VEIEX | D171: 4%
B172: Vanguard International Value Inv | C172: VTRIX | D172: 13%
B173: Vanguard Inflation-Protected Secs | C173: VIPSX | D173: 40%
C174: TOTAL | D174: 100%
A176: P23 | B176: Larry Swedroe Min Fat Tails
B177: Vanguard Small Cap Value Index | C177: VISVX | D177: 15%
B178: Vanguard Emerging Mkts Stock Idx | C178: VEIEX | D178: 15%
B179: Vanguard Inflation-Protected Secs | C179: VIPSX | D179: 35%
B180: Vanguard Short-Term Treasury | C180: VFISX | D180: 35%
C181: TOTAL | D181: 100%

A1: Portfolio Name | B1: 2010 Return
A2: IFA Index Portfolio 100 Bright Red | B2: 23.0%
A3: Permanent Portfolio Fund (PRPFX) | B3: 18.5%
A4: MMM Do It Yourself Funds | B4: 17.5%
A5: Dilbert World’s Simplest | B5: 16.8%
A6: Paul Boyer Permanent Portfolio (ETF) | B6: 15.8%
A7: Ted Aronson’s Lazy Portfolio | B7: 14.9%
A8: Harry Browne Permanent Portfolio (ETF) | B8: 14.5%
A9: Scott Burns’ Four Square Portfolio | B9: 14.4%
A10: Vanguard Windsor | B10: 14.2%
A11: Bill Schultheis’ Coffeehouse Portfolio Vanguard | B11: 13.6%
A12: David Swensen’s Yale Endowment | B12: 13.5%
A13: IFA Index Portfolio 50 | B13: 13.0%
A14: David Swensen’s Lazy Portfolio | B14: 12.9%
A15: Taylor Larimore 3 Fund | B15: 12.2%
A16: Larry Swedroe Simple | B16: 12.1%
A17: Rick Ferri Core Four | B17: 12.1%
A18: Taylor Larimore 4 Fund | B18: 12.1%
A19: William Bernstein’s Basic No-Brainer Portfolio | B19: 12.1%
A20: William Bernstein’s No Brainer Cowards Portfolio | B20: 12.0%
A21: Scott Burns’ Five Fold Portfolio | B21: 10.9%
A22: Scott Burns’ Couch Potato Portfolio | B22: 10.6%
A23: Scott Burns’ Six Ways from Sunday Portfolio | B23: 10.6%
A24: Scott Burns’ Margarita Portfolio | B24: 10.1%
A25: FundAdvice Ultimate Buy & Hold | B25: 10.0%
A26: Larry Swedroe Min Fat Tails | B26: 8.0%

A1: ID# | B1: Portfolio Name | C1: YTD Return
A2: P3 | B2: Permanent Portfolio Fund (PRPFX) | C2: 0.15205585725368498
A3: P24 | B3: IFA Index Portfolio 100 Bright Red | C3: 0.14099999999999999
A4: P2 | B4: Paul Boyer Permanent Portfolio (ETF) | C4: 0.13883413352422824
A5: P1 | B5: Harry Browne Permanent Portfolio (ETF) | C5: 0.12907790574136269
A6: P14 | B6: David Swensen’s Yale Endowment | C6: 0.10963980150775265
A7: P19 | B7: Scott Burns’ Four Square Portfolio | C7: 0.1065034074132265
A8: P15 | B8: MMM Do It Yourself Funds | C8: 0.1050487959285169
A9: P10 | B9: Ted Aronson’s Lazy Portfolio | C9: 0.10372996254107192
A10: P11 | B10: Bill Schultheis’ Coffeehouse Portfolio Vanguard | C10: 0.10241587201781499
A11: P9 | B11: Dilbert World’s Simplest | C11: 0.10181999792278673
A12: P13 | B12: David Swensen’s Lazy Portfolio | C12: 9.5711022937551515E-2
A13: P22 | B13: Larry Swedroe Simple | C13: 9.2193136750671201E-2
A14: P6 | B14: Rick Ferri Core Four | C14: 8.9152316034187606E-2
A15: P17 | B15: Scott Burns’ Couch Potato Portfolio | C15: 8.7254143454132294E-2
A16: P7 | B16: William Bernstein’s No Brainer Cowards Portfolio | C16: 8.3464055331180953E-2
A17: P25 | B17: IFA Index Portfolio 50 | C17: 8.2000000000000003E-2
A18: P20 | B18: Scott Burns’ Five Fold Portfolio | C18: 8.0561375719610862E-2
A19: P23 | B19: Larry Swedroe Min Fat Tails | C19: 7.784427184184084E-2
A20: P12 | B20: FundAdvice Ultimate Buy & Hold | C20: 7.726613320535014E-2
A21: P8 | B21: William Bernstein’s Basic No-Brainer Portfolio | C21: 7.2930115468440082E-2
A22: P21 | B22: Scott Burns’ Six Ways from Sunday Portfolio | C22: 7.2188369306745326E-2
A23: P5 | B23: Taylor Larimore 4 Fund | C23: 7.0941273923260217E-2
A24: P4 | B24: Taylor Larimore 3 Fund | C24: 7.0374251940955812E-2
A25: P18 | B25: Scott Burns’ Margarita Portfolio | C25: 6.5661571823588893E-2
A26: P16 | B26: Vanguard Windsor | C26: 6.3398140321217156E-2

A1: ID# | B1: Portfolio Name | C1: YTD Return
A2: P2 | B2: Paul Boyer Permanent Portfolio (ETF) | C2: 0.13851141862374017
A3: P3 | B3: Permanent Portfolio Fund (PRPFX) | C3: 0.13757434703904825
A4: P14 | B4: David Swensen’s Yale Endowment | C4: 0.12815713901703263
A5: P19 | B5: Scott Burns’ Four Square Portfolio | C5: 0.12810038876689278
A6: P24 | B6: IFA Index Portfolio 100 Bright Red | C6: 0.127
A7: P1 | B7: Harry Browne Permanent Portfolio (ETF) | C7: 0.12653762542388369
A8: P9 | B8: Dilbert World’s Simplest | C8: 0.11412036354368049
A9: P20 | B9: Scott Burns’ Five Fold Portfolio | C9: 0.11331012817244535
A10: P13 | B10: David Swensen’s Lazy Portfolio | C10: 0.11201451596964507
A11: P10 | B11: Ted Aronson’s Lazy Portfolio | C11: 0.10966698364405736
A12: P15 | B12: MMM Do It Yourself Funds | C12: 0.10753564945149785
A13: P11 | B13: Bill Schultheis’ Coffeehouse Portfolio Vanguard | C13: 0.10658581096395592
A14: P22 | B14: Larry Swedroe Simple | C14: 9.9278244710370611E-2
A15: P6 | B15: Rick Ferri Core Four | C15: 9.6808684821537483E-2
A16: P21 | B16: Scott Burns’ Six Ways from Sunday Portfolio | C16: 9.4676405185308177E-2
A17: P12 | B17: FundAdvice Ultimate Buy & Hold | C17: 9.3562105696433528E-2
A18: P17 | B18: Scott Burns’ Couch Potato Portfolio | C18: 9.3383174656716417E-2
A19: P7 | B19: William Bernstein’s No Brainer Cowards Portfolio | C19: 8.6781305077015869E-2
A20: P23 | B20: Larry Swedroe Min Fat Tails | C20: 8.6377597994876432E-2
A21: P18 | B21: Scott Burns’ Margarita Portfolio | C21: 8.5919773086119866E-2
A22: P5 | B22: Taylor Larimore 4 Fund | C22: 8.4802668827624217E-2
A23: P25 | B23: IFA Index Portfolio 50 | C23: 8.43E-2
A24: P4 | B24: Taylor Larimore 3 Fund | C24: 8.2954829732675428E-2
A25: P8 | B25: William Bernstein’s Basic No-Brainer Portfolio | C25: 7.7239211507156513E-2
A26: P16 | B26: Vanguard Windsor | C26: 6.1707523245984719E-2

A1: Legend Key | B1: Portfolio Name
A2: P1 HBPP | B2: Harry Browne Permanent Portfolio
A3: P2 PBPP | B3: Paul Boyer Permanent Portfolio
A4: P3 PRPFX | B4: Permanent Portfolio Mutual Fund
A5: P4 CH | B5: Bill Schultheis Coffee House
A6: P5 BBNBC | B6: Bill Berstein No Brainer Cowards
A7: P6 BBNB | B7: Bill Berstein No Brainer
A8: P7 DP | B8: Dilbert’s Portfolio
A9: P8 FAUBH | B9: FundAdvice Ultimate Buy & Hold
A10: P9 DSLP | B10: David Swenson Lazy Portfolio
A11: P10 DSYE | B11: David Swenson Yale Endowment
A12: P11 RFCF | B12: Rick Ferri Core Four
A13: P12 SBCP | B13: Scott Burns Couch Portfolio
A14: P13 SBM | B14: Scott Burns Margaritaville
A15: P14 SBFS | B15: Scott Burns Four Square
A16: P15 SBFF | B16: Scott Burns Five Fold
A17: P16 SBSWS | B17: Scott Burns Six Ways from Sunday
A18: P17 LSSP | B18: Larry Swedroe Simple Portfolio
A19: P18 LSMFTP | B19: Larry Swedroe Minimize FatTails Portfolio
A20: P19 VW | B20: Vanguard Windsor
A21: P20 TAFT | B21: Ted Aronson Family Taxable
A22: P21 2nd | B22: 2nd Grader
A23: P22 6 SIB | B23: Six Core Asset Index Funds Strategic Asset Allocation Moderate
A24: S&P 500 | B24: Standard & Poors 500 Index

A1: ID# | B1: Portfolio Name | C1: YTD Return
A2: P2 | B2: Paul Boyer Permanent Portfolio (ETF) | C2: 0.13099105346717277
A3: P1 | B3: Harry Browne Permanent Portfolio (ETF) | C3: 0.117883616091357
A4: P3 | B4: Permanent Portfolio Fund (PRPFX) | C4: 0.1080941298163951
A5: P14 | B5: David Swensen’s Yale Endowment | C5: 9.4621721291904937E-2
A6: P24 | B6: IFA Index Portfolio 100 Bright Red | C6: 8.7999999999999995E-2
A7: P19 | B7: Scott Burns’ Four Square Portfolio | C7: 8.2943841613960512E-2
A8: P11 | B8: Bill Schultheis’ Coffeehouse Portfolio Vanguard | C8: 7.8670871942437604E-2
A9: P10 | B9: Ted Aronson’s Lazy Portfolio | C9: 7.6735145576698693E-2
A10: P9 | B10: Dilbert World’s Simplest | C10: 7.4349640759072688E-2
A11: P13 | B11: David Swensen’s Lazy Portfolio | C11: 7.2176898065644313E-2
A12: P20 | B12: Scott Burns’ Five Fold Portfolio | C12: 7.0928877864973039E-2
A13: P15 | B13: MMM Do It Yourself Funds | C13: 6.6723325194020688E-2
A14: P12 | B14: FundAdvice Ultimate Buy & Hold | C14: 6.5088348284339403E-2
A15: P22 | B15: Larry Swedroe Simple | C15: 6.442838530393713E-2
A16: P23 | B16: Larry Swedroe Min Fat Tails | C16: 6.4100629839416889E-2
A17: P6 | B17: Rick Ferri Core Four | C17: 5.9553830797732799E-2
A18: P7 | B18: William Bernstein’s No Brainer Cowards Portfolio | C18: 5.9291422385638448E-2
A19: P25 | B19: IFA Index Portfolio 50 | C19: 5.8700000000000002E-2
A20: P17 | B20: Scott Burns’ Couch Potato Portfolio | C20: 5.5027407354050872E-2
A21: P21 | B21: Scott Burns’ Six Ways from Sunday Portfolio | C21: 5.3076237222318579E-2
A22: P18 | B22: Scott Burns’ Margarita Portfolio | C22: 4.8127087440754224E-2
A23: P4 | B23: Taylor Larimore 3 Fund | C23: 4.7929234504119567E-2
A24: P5 | B24: Taylor Larimore 4 Fund | C24: 4.7091378804667405E-2
A25: P8 | B25: William Bernstein’s Basic No-Brainer Portfolio | C25: 4.3672903542719466E-2
A26: P16 | B26: Vanguard Windsor | C26: 2.0287404902789463E-2

A1: ID# | B1: Portfolio Name | C1: YTD Return
A2: P2 | B2: Paul Boyer Permanent Portfolio (ETF) | C2: 9.8%
A3: P1 | B3: Harry Browne Permanent Portfolio (ETF) | C3: 8.9%
A4: P3 | B4: Permanent Portfolio Fund | C4: 6.0%
A5: P14 | B5: David Swensen’s Yale Endowment | C5: 4.4%
A6: P23 | B6: Larry Swedroe Min Fat Tails | C6: 3.0%
A7: P11 | B7: Bill Schultheis’ Coffeehouse Portfolio Vanguard | C7: 2.8%
A8: P19 | B8: Scott Burns’ Four Square Portfolio | C8: 2.6%
A9: P20 | B9: Scott Burns’ Five Fold Portfolio | C9: 2.0%
A10: P13 | B10: David Swensen’s Lazy Portfolio | C10: 1.8%
A11: P12 | B11: FundAdvice Ultimate Buy & Hold | C11: 1.0%
A12: P17 | B12: Scott Burns’ Couch Potato Portfolio | C12: 1.0%
A13: P7 | B13: William Bernstein’s No Brainer Cowards Portfolio | C13: 0.6%
A14: P22 | B14: Larry Swedroe Simple | C14: 0.5%
A15: P25 | B15: IFA Index Portfolio 50 | C15: -0.2%
A16: P10 | B16: Ted Aronson’s Lazy Portfolio | C16: -0.2%
A17: P21 | B17: Scott Burns’ Six Ways from Sunday Portfolio | C17: -0.4%
A18: P6 | B18: Rick Ferri Core Four | C18: -0.8%
A19: P18 | B19: Scott Burns’ Margarita Portfolio | C19: -1.5%
A20: P24 | B20: IFA Index Portfolio 100 Bright Red | C20: -2.1%
A21: P9 | B21: Dilbert World’s Simplest | C21: -2.4%
A22: P4 | B22: Taylor Larimore 3 Fund | C22: -2.4%
A23: P5 | B23: Taylor Larimore 4 Fund | C23: -2.6%
A24: P8 | B24: William Bernstein’s Basic No-Brainer Portfolio | C24: -2.8%
A25: P15 | B25: MMM Do It Yourself Funds | C25: -3.0%
A26: P16 | B26: Vanguard Windsor | C26: -6.7%

A1: ID# | B1: Portfolio Name | C1: YTD Return
A2: P2 | B2: Paul Boyer Permanent Portfolio (ETF) | C2: 7.0052495945843729E-2
A3: P1 | B3: Harry Browne Permanent Portfolio (ETF) | C3: 6.1089365902458947E-2
A4: P14 | B4: David Swensen’s Yale Endowment | C4: 5.2498039844598887E-2
A5: P11 | B5: Bill Schultheis’ Coffeehouse Portfolio Vanguard | C5: 4.9169455421209429E-2
A6: P3 | B6: Permanent Portfolio Fund | C6: 4.4737522627359638E-2
A7: P19 | B7: Scott Burns’ Four Square Portfolio | C7: 4.4266739192539983E-2
A8: P13 | B8: David Swensen’s Lazy Portfolio | C8: 3.7932470359609782E-2
A9: P23 | B9: Larry Swedroe Min Fat Tails | C9: 3.5294548334391385E-2
A10: P24 | B10: IFA Index Portfolio 100 Bright Red | C10: 3.4782527435202652E-2
A11: P20 | B11: Scott Burns’ Five Fold Portfolio | C11: 3.3195789136429843E-2
A12: P7 | B12: William Bernstein’s No Brainer Cowards Portfolio | C12: 3.0419344215081079E-2
A13: P22 | B13: Larry Swedroe Simple | C13: 2.8831768906431465E-2
A14: P12 | B14: FundAdvice Ultimate Buy & Hold | C14: 2.8105048827137491E-2
A15: P25 | B15: IFA Index Portfolio 50 Bright Red | C15: 2.5999999999999999E-2
A16: P10 | B16: Ted Aronson’s Lazy Portfolio | C16: 2.4081278411915319E-2
A17: P15 | B17: MMM Do It Yourself Funds | C17: 2.4061709260821074E-2
A18: P17 | B18: Scott Burns’ Couch Potato Portfolio | C18: 2.3654636637055138E-2
A19: P6 | B19: Rick Ferri Core Four | C19: 2.01491482481444E-2
A20: P21 | B20: Scott Burns’ Six Ways from Sunday Portfolio | C20: 1.6326808699858919E-2
A21: P9 | B21: Dilbert World’s Simplest | C21: 1.1245245236448653E-2
A22: P8 | B22: William Bernstein’s Basic No-Brainer Portfolio | C22: 1.053393027891536E-2
A23: P4 | B23: Taylor Larimore 3 Fund | C23: 5.7982065191874987E-3
A24: P18 | B24: Scott Burns’ Margarita Portfolio | C24: 5.0482281113128913E-3
A25: P5 | B25: Taylor Larimore 4 Fund | C25: 4.0843612011500774E-3
A26: P16 | B26: Vanguard Windsor | C26: -1.0143702451394732E-2

A1: ID# | B1: Portfolio Name | C1: YTD Return
A2: P2 | B2: Paul Boyer Permanent Portfolio | C2: 5.9792600803000084E-2
A3: P1 | B3: Harry Browne Permanent Portfolio | C3: 5.3585722066454178E-2
A4: P3 | B4: Permanent Portfolio Fund | C4: 2.4566847685544291E-2
A5: P23 | B5: Larry Swedroe Min Fat Tails | C5: 9.1354108277970081E-3
A6: P11 | B6: Bill Schultheis’ Coffeehouse Portfolio Vanguard | C6: -3.3305613743068729E-3
A7: P14 | B7: David Swensen’s Yale Endowment | C7: -9.195735469875288E-3
A8: P17 | B8: Scott Burns’ Couch Potato Portfolio | C8: -1.2544092485820113E-2
A9: P22 | B9: Larry Swedroe Simple | C9: -1.8522443751589179E-2
A10: P7 | B10: William Bernstein’s No Brainer Cowards Portfolio | C10: -2.0231849115479927E-2
A11: P19 | B11: Scott Burns’ Four Square Portfolio | C11: -2.4575131196078237E-2
A12: P13 | B12: David Swensen’s Lazy Portfolio | C12: -2.4698465463972585E-2
A13: P25 | B13: IFA Index Portfolio 50 Bright Red | C13: -2.52E-2
A14: P12 | B14: FundAdvice Ultimate Buy & Hold | C14: -2.6325340234934713E-2
A15: P20 | B15: Scott Burns’ Five Fold Portfolio | C15: -3.3242918539676092E-2
A16: P10 | B16: Ted Aronson’s Lazy Portfolio | C16: -3.8506752902575769E-2
A17: P24 | B17: IFA Index Portfolio 100 Bright Red | C17: -4.3999999999999997E-2
A18: P6 | B18: Rick Ferri Core Four | C18: -4.6160033243078935E-2
A19: P8 | B19: William Bernstein’s Basic No-Brainer Portfolio | C19: -4.7957270261635321E-2
A20: P18 | B20: Scott Burns’ Margarita Portfolio | C20: -4.9332852757249412E-2
A21: P21 | B21: Scott Burns’ Six Ways from Sunday Portfolio | C21: -5.1519933652109162E-2
A22: P15 | B22: MMM Do It Yourself Funds | C22: -5.2379977742028627E-2
A23: P4 | B23: Taylor Larimore 3 Fund | C23: -5.8397838548045922E-2
A24: P5 | B24: Taylor Larimore 4 Fund | C24: -5.9368716144168387E-2
A25: P9 | B25: Dilbert World’s Simplest | C25: -6.6718150368629381E-2
A26: P16 | B26: Vanguard Windsor | C26: -8.7321578505457631E-2

A1: ID | B1: FUND NAME | C1: TICKER | D1: % | E1: YTD Return
A2: P1 | B2: Harry Browne Permanent Portfolio
B3: Vanguard Total Stock Mkt Idx | C3: VTSMX | D3: 0.25 | E3: -6.435100548446071E-2
B4: Vanguard Long-Term Treasury Investor | C4: VUSTX | D4: 0.25 | E4: 0.12406716417910446
B5: Vanguard Short-Term Treasury | C5: VFISX | D5: 0.25 | E5: 2.0715630885122405E-2
B6: SPDR Gold Shares | C6: GLD | D6: 0.25 | E6: 0.13391109868604989
E7: 5.3585722066454178E-2
A8: P2 | B8: Paul Boyer Permanent Portfolio
B9: Vanguard Small Cap Value Index | C9: VISVX | D9: 0.125 | E9: -9.9616858237548955E-3
B10: Vanguard Emerging Mkts Stock Idx | C10: VEIEX | D10: 0.125 | E10: -6.9085295252798162E-2
B11: Vanguard Long-Term Treasury Investor | C11: VUSTX | D11: 0.25 | E11: 0.12406716417910446
B12: Vanguard Short-Term Treasury | C12: VFISX | D12: 0.25 | E12: 2.0715630885122405E-2
B13: SPDR Gold Shares | C13: GLD | D13: 0.25 | E13: 0.13391109868604989
E14: 5.9792600803000084E-2
A16: P3 | B16: Permanent Portfolio Fund | C16: PRPFX | D16: 1 | E16: 2.4566847685544291E-2
A19: P4 | B19: Taylor Larimore 3 Fund
B20: Vanguard Total Intl Stock Index | C20: VTSMX | D20: 0.5 | E20: -6.435100548446071E-2
B21: Vanguard Short-Term Bond Index | C21: VGTSX | D21: 0.3 | E21: -0.12005551700208195
B22: Vanguard Total Bond Market Index | C22: VBMFX | D22: 0.2 | E22: 4.8971596474045143E-2
C23: TOTAL | D23: =SUM(D20:D22) -> 1 | E23: -5.8397838548045922E-2
A25: P5 | B25: Taylor Larimore 4 Fund
B26: Vanguard Total Intl Stock Index | C26: VTSMX | D26: 0.5 | E26: -6.435100548446071E-2
B27: Vanguard Short-Term Bond Index | C27: VGTSX | D27: 0.3 | E27: -0.12005551700208195
B28: Vanguard Total Bond Market Index | C28: VBMFX | D28: 0.1 | E28: 4.8971596474045143E-2
B29: Vanguard Inflation-Protected Secs | C29: VIPSX | D29: 0.1 | E29: 3.9262820512820484E-2
C30: TOTAL | D30: =SUM(D26:D29) -> 1 | E30: -5.9368716144168387E-2
A32: P6 | B32: Rick Ferri Core Four
B33: Vanguard Total Intl Stock Index | C33: VTSMX | D33: 0.48 | E33: -6.435100548446071E-2
B34: Vanguard REIT Index | C34: VGSIX | D34: 0.08 | E34: 4.6843177189409335E-2
B35: Vanguard Total Intl Stock Index | C35: VGTSX | D35: 0.24 | E35: -0.12005551700208195
B36: Vanguard Total Bond Market Index | C36: VBMFX | D36: 0.2 | E36: 4.8971596474045143E-2
C37: TOTAL | D37: =SUM(D33:D36) -> 1 | E37: -4.6160033243078935E-2
A39: P7 | B39: William Bernstein’s No Brainer Cowards Portfolio
B40: Vanguard Short-Term Investment-Grade | C40: VFSTX | D40: 0.4 | E40: 2.4832855778414542E-2
B41: Vanguard Total Stock Mkt Idx | C41: VTSMX | D41: 0.15 | E41: -6.435100548446071E-2
B42: Vanguard Small Cap Value Index | C42: VISVX | D42: 0.1 | E42: -9.9616858237548955E-3
B43: Vanguard Value Index | C43: VIVAX | D43: 0.1 | E43: -6.0409924487594302E-2
B44: Vanguard Emerging Mkts Stock Idx | C44: VEIEX | D44: 0.05 | E44: -6.9085295252798162E-2
B45: Vanguard European Stock Index | C45: VEURX | D45: 0.05 | E45: -0.16885119506553592
B46: Vanguard Pacific Stock Index | C46: VPACX | D46: 0.05 | E46: -6.9214876033057871E-2
B47: Vanguard REIT Index | C47: VGSIX | D47: 0.05 | E47: 4.6843177189409335E-2
B48: Vanguard Tax-Managed Small Cap Inv | C48: VTMSX | D48: 0.05 | E48: -9.1954022988505191E-3
C49: TOTAL | D49: =SUM(D40:D48) -> 1 | E49: -2.0231849115479927E-2
A51: P8 | B51: William Bernstein’s Basic No-Brainer Portfolio
B52: Vanguard 500 Index | C52: VFINX | D52: 0.25 | E52: -7.1784841075794636E-2
B53: Vanguard Tax-Managed Small Cap Inv | C53: VTMSX | D53: 0.25 | E53: -9.1954022988505191E-3
B54: Vanguard Tax-Managed Intl | C54: VTMGX | D54: 0.25 | E54: -0.13698630136986301
B55: Vanguard Short-Term Bond Index | C55: VBISX | D55: 0.25 | E55: 2.6137463697966989E-2
C56: TOTAL | D56: =SUM(D52:D55) -> 1 | E56: -4.7957270261635321E-2
A58: P9 | B58: Dilbert World’s Simplest
B59: Vanguard Total Intl Stock Index | C59: VTSMX | D59: 0.5 | E59: -6.435100548446071E-2
B60: Vanguard Short-Term Bond Index | C60: VEIEX | D60: 0.5 | E60: -6.9085295252798162E-2
C61: TOTAL | D61: =SUM(D59:D60) -> 1 | E61: -6.6718150368629381E-2
A63: P10 | B63: Ted Aronson’s Lazy Portfolio
B64: Vanguard Emerging Mkts Stock Idx | C64: VEIEX | D64: 0.2 | E64: -6.9085295252798162E-2
B65: Vanguard 500 Index | C65: VFINX | D65: 0.15 | E65: -7.1784841075794636E-2
B66: Vanguard Pacific Stock Index | C66: VPACX | D66: 0.15 | E66: -6.9214876033057871E-2
B67: Vanguard Extended Market Idx | C67: VEXMX | D67: 0.1 | E67: -1.7753290480563177E-2
B68: Vanguard Inflation-Protected Secs | C68: VIPSX | D68: 0.1 | E68: 3.9262820512820484E-2
B69: Vanguard European Stock Index | C69: VEURX | D69: 0.05 | E69: -0.16885119506553592
B70: Vanguard High-Yield Corporate | C70: VWEHX | D70: 0.05 | E70: 2.2514071294559068E-2
B71: Vanguard Long-Term U.S. Treasury | C71: VUSTX | D71: 0.05 | E71: 0.12406716417910446
B72: Vanguard Small Cap Growth Index | C72: VISGX | D72: 0.05 | E72: -1.723113487819361E-2
B73: Vanguard Small Cap Value Index | C73: VISVX | D73: 0.05 | E73: -9.9616858237548955E-3
B74: Vanguard Total Stock Mkt Idx | C74: VTSMX | D74: 0.05 | E74: -6.435100548446071E-2
C75: TOTAL | D75: =SUM(D64:D74) -> 1 | E75: -3.8506752902575769E-2
A77: P11 | B77: Bill Schultheis’ Coffeehouse Portfolio Vanguard
B78: Vanguard Total Bond Market Index | C78: VBMFX | D78: 0.4 | E78: 4.8971596474045143E-2
B79: Vanguard 500 Index | C79: VFINX | D79: 0.1 | E79: -7.1784841075794636E-2
B80: Vanguard Value Index | C80: VIVAX | D80: 0.1 | E80: -6.0409924487594302E-2
B81: Vanguard Total Intl Stock Index | C81: VGTSX | D81: 0.1 | E81: -0.12005551700208195
B82: Vanguard REIT Index | C82: VGSIX | D82: 0.1 | E82: 4.6843177189409335E-2
B83: Vanguard Small Cap Value Index | C83: VISVX | D83: 0.1 | E83: -9.9616858237548955E-3
B84: Vanguard Small Cap Index | C84: NAESX | D84: 0.1 | E84: -1.3823208439432522E-2
C85: TOTAL | D85: =SUM(D78:D84) -> 1 | E85: -3.3305613743068729E-3
A87: P12 | B87: FundAdvice Ultimate Buy & Hold
B88: Vanguard 500 Index | C88: VFINX | D88: 0.06 | E88: -7.1784841075794636E-2
B89: Vanguard Value Index | C89: VIVAX | D89: 0.06 | E89: -6.0409924487594302E-2
B90: Vanguard Small Cap Index | C90: NAESX | D90: 0.06 | E90: -1.3823208439432522E-2
B91: Vanguard Small Cap Value Index | C91: VISVX | D91: 0.06 | E91: -9.9616858237548955E-3
B92: Vanguard REIT Index | C92: VGSIX | D92: 0.06 | E92: 4.6843177189409335E-2
B93: Vanguard Developed Markets Index | C93: VDMIX | D93: 0.12 | E93: -0.13536201469045117
B94: Vanguard Inflation-Protected Secs | C94: VIPSX | D94: 0.08 | E94: 3.9262820512820484E-2
B95: Vanguard Interm-Term U.S. Treas | C95: VFITX | D95: 0.2 | E95: 6.3129002744739315E-2
B96: Vanguard Short-Term Treasury | C96: VFISX | D96: 0.12 | E96: 2.0715630885122405E-2
B97: Vanguard International Value | C97: VTRIX | D97: 0.12 | E97: -0.14701078079059127
B98: Vanguard Emerging Mkts Stock Idx | C98: VEIEX | D98: 0.06 | E98: -6.9085295252798162E-2
C99: TOTAL | D99: =SUM(D88:D98) -> 1 | E99: -2.6325340234934713E-2
A101: P13 | B101: David Swensen’s Lazy Portfolio
B102: Vanguard Total Stock Mkt Idx | C102: VTSMX | D102: 0.3 | E102: -6.435100548446071E-2
B103: Vanguard REIT Index | C103: VGSIX | D103: 0.2 | E103: 4.6843177189409335E-2
B104: Vanguard Developed Markets Index | C104: VDMIX | D104: 0.15 | E104: -0.13536201469045117
B105: Vanguard Emerging Mkts Stock Idx | C105: VEIEX | D105: 0.05 | E105: -6.9085295252798162E-2
B106: Vanguard Inflation-Protected Secs | C106: VIPSX | D106: 0.15 | E106: 3.9262820512820484E-2
B107: Vanguard Short-Term Treasury | C107: VFISX | D107: 0.15 | E107: 2.0715630885122405E-2
C108: TOTAL | D108: =SUM(D102:D107) -> 1 | E108: -2.4698465463972585E-2
A110: P14 | B110: David Swensen’s Yale Endowment
B111: Vanguard Total Stock Mkt Idx | C111: VTSMX | D111: 0.3 | E111: -6.435100548446071E-2
B112: Vanguard REIT Index | C112: VGSIX | D112: 0.2 | E112: 4.6843177189409335E-2
B113: Vanguard Developed Markets Index | C113: VDMIX | D113: 0.15 | E113: -0.13536201469045117
B114: Vanguard Emerging Mkts Stock Idx | C114: VEIEX | D114: 0.05 | E114: -6.9085295252798162E-2
B115: Vanguard Inflation-Protected Secs | C115: VIPSX | D115: 0.15 | E115: 3.9262820512820484E-2
B116: Vanguard Short-Term Treasury | C116: VUSTX | D116: 0.15 | E116: 0.12406716417910446
C117: TOTAL | D117: =SUM(D111:D116) -> 1 | E117: -9.195735469875288E-3
A119: P15 | B119: MMM Do It Yourself Funds
B120: Vanguard 500 Index | C120: VFINX | D120: 0.12 | E120: -7.1784841075794636E-2
B121: Vanguard Value Index | C121: VIVAX | D121: 0.12 | E121: -6.0409924487594302E-2
B122: Vanguard Small Cap Value Index | C122: VISVX | D122: 0.2 | E122: -9.9616858237548955E-3
B123: Bridgeway Ultra-Small Company Market | C123: BRSIX | D123: 0.2 | E123: -1.9246861924686054E-2
B124: Vanguard REIT Index | C124: VGSIX | D124: 0.05 | E124: 4.6843177189409335E-2
B125: Vanguard International Value | C125: VTRIX | D125: 0.09 | E125: -0.14701078079059127
B126: Vanguard International Explorer | C126: VGTSX | D126: 0.09 | E126: -0.12005551700208195
B127: Vanguard Emerging Mkts Stock Idx | C127: VEIEX | D127: 0.13 | E127: -6.9085295252798162E-2
C128: TOTAL | D128: =SUM(D120:D127) -> 1 | E128: -5.2379977742028627E-2
A130: P16 | B130: Vanguard Windsor | C130: VWNDX | D130: 1 | E130: -8.7321578505457631E-2
A132: P17 | B132: Scott Burns’ Couch Potato Portfolio
B133: Vanguard Total Stock Mkt Idx | C133: VTSMX | D133: 0.5 | E133: -6.435100548446071E-2
B134: Vanguard Inflation-Protected Secs | C134: VIPSX | D134: 0.5 | E134: 3.9262820512820484E-2
C135: TOTAL | D135: =SUM(D133:D134) -> 1 | E135: -1.2544092485820113E-2
A137: P18 | B137: Scott Burns’ Margarita Portfolio
B138: Vanguard Total Stock Mkt Idx | C138: VTSMX | D138: 0.33300000000000002 | E138: -6.435100548446071E-2
B139: Vanguard Inflation-Protected Secs | C139: VIPSX | D139: 0.33300000000000002 | E139: 3.9262820512820484E-2
B140: Vanguard Total Intl Stock Index | C140: VGTSX | D140: 0.33300000000000002 | E140: -0.12005551700208195
C141: TOTAL | D141: =SUM(D138:D140) -> 0.99900000000000011 | E141: -4.9332852757249412E-2
A143: P19 | B143: Scott Burns’ Four Square Portfolio
B144: Vanguard Total Stock Mkt Idx | C144: VTSMX | D144: 0.25 | E144: -6.435100548446071E-2
B145: Vanguard Inflation-Protected Secs | C145: VIPSX | D145: 0.25 | E145: 3.9262820512820484E-2
B146: Vanguard Total Intl Stock Index | C146: VGTSX | D146: 0.25 | E146: -0.12005551700208195
B147: Vanguard REIT Index | C147: VGSIX | D147: 0.25 | E147: 4.6843177189409335E-2
C148: TOTAL | D148: =SUM(D144:D147) -> 1 | E148: -2.4575131196078237E-2
A150: P20 | B150: Scott Burns’ Five Fold Portfolio
B151: Vanguard Total Stock Mkt Idx | C151: VTSMX | D151: 0.2 | E151: -6.435100548446071E-2
B152: Vanguard Inflation-Protected Secs | C152: VIPSX | D152: 0.2 | E152: 3.9262820512820484E-2
B153: Vanguard Total Intl Stock Index | C153: VGTSX | D153: 0.2 | E153: -0.12005551700208195
B154: Vanguard REIT Index | C154: VGSIX | D154: 0.2 | E154: 4.6843177189409335E-2
B155: American Century International Bd Inv | C155: BEGBX | D155: 0.2 | E155: -6.7914067914067955E-2
C156: TOTAL | D156: =SUM(D151:D155) -> 1 | E156: -3.3242918539676092E-2
A158: P21 | B158: Scott Burns’ Six Ways from Sunday Portfolio
B159: Vanguard Total Stock Mkt Idx | C159: VTSMX | D159: =100%/6 -> 0.16666666666666666 | E159: -6.435100548446071E-2
B160: Vanguard Inflation-Protected Secs | C160: VIPSX | D160: =100%/6 -> 0.16666666666666666 | E160: 3.9262820512820484E-2
B161: Vanguard Total Intl Stock Index | C161: VGTSX | D161: =100%/6 -> 0.16666666666666666 | E161: -0.12005551700208195
B162: Vanguard REIT Index | C162: VGSIX | D162: =100%/6 -> 0.16666666666666666 | E162: 4.6843177189409335E-2
B163: American Century International Bd Inv | C163: BEGBX | D163: =100%/6 -> 0.16666666666666666 | E163: -6.7914067914067955E-2
B164: Vanguard Energy | C164: VGENX | D164: =100%/6 -> 0.16666666666666666 | E164: -0.14290500921427374
C165: TOTAL | D165: =SUM(D159:D164) -> 1 | E165: -5.1519933652109162E-2
A167: P22 | B167: Larry Swedroe Simple
B168: Vanguard Value Index | C168: VIVAX | D168: 0.15 | E168: -6.0409924487594302E-2
B169: Vanguard Small Cap Value Index | C169: VISVX | D169: 0.15 | E169: -9.9616858237548955E-3
B170: Vanguard Small Cap Index | C170: NAESX | D170: 0.13 | E170: -1.3823208439432522E-2
B171: Vanguard Emerging Mkts Stock Idx | C171: VEIEX | D171: 0.04 | E171: -6.9085295252798162E-2
B172: Vanguard International Value Inv | C172: VTRIX | D172: 0.13 | E172: -0.14701078079059127
B173: Vanguard Inflation-Protected Secs | C173: VIPSX | D173: 0.4 | E173: 3.9262820512820484E-2
C174: TOTAL | D174: =SUM(D168:D173) -> 1 | E174: -1.8522443751589179E-2
A176: P23 | B176: Larry Swedroe Min Fat Tails
B177: Vanguard Small Cap Value Index | C177: VISVX | D177: 0.15 | E177: -9.9616858237548955E-3
B178: Vanguard Emerging Mkts Stock Idx | C178: VEIEX | D178: 0.15 | E178: -6.9085295252798162E-2
B179: Vanguard Inflation-Protected Secs | C179: VIPSX | D179: 0.35 | E179: 3.9262820512820484E-2
B180: Vanguard Short-Term Treasury | C180: VFISX | D180: 0.35 | E180: 2.0715630885122405E-2
C181: TOTAL | D181: =SUM(D177:D180) -> 1 | E181: 9.1354108277970081E-3
A183: P24 | B183: IFA Index Portfolio 100 Bright Red
B184: DFA U.S. Large Company | C184: DFUSX | D184: 0.12 | E184: -7.1917808219177926E-2
B185: DFA U.S. Large Cap Value | C185: DFLVX | D185: 0.12 | E185: -4.4143613890523792E-2
B186: DFA U.S. Micro Cap | C186: DFSTX | D186: 0.2 | E186: -4.8573163327260138E-3
B187: DFA U.S. Small Cap Value | C187: DFFVX | D187: 0.2 | E187: -1.3846153846153841E-2
B188: DFA Real Estate Securities | C188: DFGEX | D188: 0.05 | E188: -1.3138686131386801E-2
B189: DFA Intl Value | C189: DFIVX | D189: 0.06 | E189: -0.14377934272300463
B190: DFA Intl Small Company | C190: DFISX | D190: 0.06 | E190: -6.8917018284106901E-2
B191: DFA Intl Small Cap Value | C191: DISVX | D191: 0.06 | E191: -0.10735586481113313
B192: DFA Emerging Markets | C192: DFEMX | D192: 0.04 | E192: -6.0405156537753135E-2
B193: DFA Emerging Markets Value | C193: DFEVX | D193: 0.04 | E193: -6.8384223918575127E-2
B194: DFA Emerging Markets Small Cap | C194: DEMSX | D194: 0.05 | E194: -1.7516743946419333E-2
C195: TOTAL | D195: =SUM(D184:D194) -> 1 | E195: -4.8514449069767367E-2
A197: P25 | B197: IFA Index Portfolio 50 Bright Red
B198: DFA U.S. Large Company | C198: DFUSX | D198: 0.12 | E198: -7.1917808219177926E-2
B199: DFA U.S. Large Cap Value | C199: DFLVX | D199: 0.12 | E199: -4.4143613890523792E-2
B200: US Small Cap | C200: DFSTX | D200: 0.06 | E200: -4.8573163327260138E-3
B201: DFA U.S. Small Cap Value | C201: DFFVX | D201: 0.06 | E201: -1.3846153846153841E-2
B202: DFA Real Estate Securities | C202: DFGEX | D202: 0.06 | E202: -1.3138686131386801E-2
B203: DFA Intl Value | C203: DFIVX | D203: 0.06 | E203: -0.14377934272300463
B204: DFA Intl Small Company | C204: DFISX | D204: 0.03 | E204: -6.8917018284106901E-2
B205: DFA Intl Small Cap Value | C205: DISVX | D205: 0.03 | E205: -0.10735586481113313
B206: DFA Emerging Markets | C206: DFEMX | D206: 1.7999999999999999E-2 | E206: -6.0405156537753135E-2
B207: DFA Emerging Markets Value | C207: DFEVX | D207: 1.7999999999999999E-2 | E207: -6.8384223918575127E-2
B208: DFA Emerging Markets Small Cap | C208: DEMSX | D208: 2.4E-2 | E208: -1.7516743946419333E-2
B209: DFA One-Year Fixed-Income I | C209: DFIHX | D209: 0.1 | E209: 5.8309037900874383E-3
B210: DFA Two-Year Global Fixed-Income I | C210: DFGFX | D210: 0.1 | E210: 1.0848126232741562E-2
B211: DFA Five-Year Government I | C211: DFFGX | D211: 0.1 | E211: 2.8116213683224034E-2
B212: DFA Five-Year Global Fixed-Income I | C212: DFGBX | D212: 0.1 | E212: 3.1847133757961776E-2
C213: TOTAL | D213: =SUM(D198:D212) -> 1 | E213: -2.9786124154133113E-2

A1: ID# | B1: Portfolio Name | C1: YTD Return
A2: P2 | B2: Paul Boyer Permanent Portfolio | C2: 5.0%
A3: P1 | B3: Harry Browne Permanent Portfolio | C3: 4.8%
A4: P3 | B4: Permanent Portfolio Fund | C4: 3.3%
A5: P11 | B5: Bill Schultheis’ Coffeehouse Portfolio Vanguard | C5: 2.6%
A6: P23 | B6: Larry Swedroe Min Fat Tails | C6: 1.6%
A7: P14 | B7: David Swensen’s Yale Endowment | C7: 1.6%
A8: P24 | B8: IFA Index Portfolio 100 Bright Red | C8: 1.3%
A9: P17 | B9: Scott Burns’ Couch Potato Portfolio | C9: 1.3%
A10: P22 | B10: Larry Swedroe Simple | C10: 1.2%
A11: P7 | B11: William Bernstein’s No Brainer Cowards Portfolio | C11: 0.9%
A12: P19 | B12: Scott Burns’ Four Square Portfolio | C12: 0.8%
A13: P13 | B13: David Swensen’s Lazy Portfolio | C13: 0.7%
A14: P25 | B14: IFA Index Portfolio 50 | C14: 0.4%
A15: P15 | B15: MMM Do It Yourself Funds | C15: 0.1%
A16: P12 | B16: FundAdvice Ultimate Buy & Hold | C16: -0.7%
A17: P20 | B17: Scott Burns’ Five Fold Portfolio | C17: -0.9%
A18: P10 | B18: Ted Aronson’s Lazy Portfolio | C18: -1.2%
A19: P6 | B19: Rick Ferri Core Four | C19: -1.2%
A20: P8 | B20: William Bernstein’s Basic No-Brainer Portfolio | C20: -1.3%
A21: P16 | B21: Vanguard Windsor | C21: -1.5%
A22: P21 | B22: Scott Burns’ Six Ways from Sunday Portfolio | C22: -2.3%
A23: P4 | B23: Taylor Larimore 3 Fund | C23: -2.8%
A24: P5 | B24: Taylor Larimore 4 Fund | C24: -2.9%
A25: P18 | B25: Scott Burns’ Margarita Portfolio | C25: -2.9%
A26: P9 | B26: Dilbert World’s Simplest | C26: -3.6%

E1: YTD
A2: ID# | B2: PORTFOLIO NAME | C2: TICKER | D2: % | E2: Return
A3: P1 | B3: Harry Browne Permanent Portfolio
B4: Vanguard Total Stock Mkt Idx | C4: VTSMX | D4: 25% | E4: -0.4%
B5: Vanguard Long-Term Treasury Investor | C5: VUSTX | D5: 25% | E5: 7.3%
B6: Vanguard Short-Term Treasury | C6: VFISX | D6: 25% | E6: 1.4%
B7: SPDR Gold Shares | C7: GLD | D7: 25% | E7: 10.8%
C8: TOTAL | D8: 100% | E8: 4.8%
A9: P2 | B9: Paul Boyer Permanent Portfolio
B10: Vanguard Small Cap Value Index | C10: VISVX | D10: 12.5% | E10: 7.7%
B11: Vanguard Emerging Mkts Stock Idx | C11: VEIEX | D11: 12.5% | E11: -6.9%
B12: Vanguard Long-Term Treasury Investor | C12: VUSTX | D12: 25% | E12: 7.3%
B13: Vanguard Short-Term Treasury | C13: VFISX | D13: 25% | E13: 1.4%
B14: SPDR Gold Shares | C14: GLD | D14: 25% | E14: 10.8%
C15: TOTAL | D15: 100% | E15: 5.0%
A17: P3 | B17: Permanent Portfolio Fund | C17: PRPFX | D17: 100% | E17: 3.3%
A20: P4 | B20: Taylor Larimore 3 Fund
B21: Vanguard Total Intl Stock Index | C21: VTSMX | D21: 50% | E21: -0.4%
B22: Vanguard Short-Term Bond Index | C22: VGTSX | D22: 30% | E22: -11.0%
B23: Vanguard Total Bond Market Index | C23: VBMFX | D23: 20% | E23: 3.2%
C24: TOTAL | D24: 100% | E24: -2.8%
A26: P5 | B26: Taylor Larimore 4 Fund
B27: Vanguard Total Intl Stock Index | C27: VTSMX | D27: 50% | E27: -0.4%
B28: Vanguard Short-Term Bond Index | C28: VGTSX | D28: 30% | E28: -11.0%
B29: Vanguard Total Bond Market Index | C29: VBMFX | D29: 10% | E29: 3.2%
B30: Vanguard Inflation-Protected Secs | C30: VIPSX | D30: 10% | E30: 2.9%
C31: TOTAL | D31: 100% | E31: -2.9%
A33: P6 | B33: Rick Ferri Core Four
B34: Vanguard Total Intl Stock Index | C34: VTSMX | D34: 48% | E34: -0.4%
B35: Vanguard REIT Index | C35: VGSIX | D35: 8% | E35: 11.5%
B36: Vanguard Total Intl Stock Index | C36: VGTSX | D36: 24% | E36: -11.0%
B37: Vanguard Total Bond Market Index | C37: VBMFX | D37: 20% | E37: 3.2%
C38: TOTAL | D38: 100% | E38: -1.2%
A40: P7 | B40: William Bernstein’s No Brainer Cowards Portfolio
B41: Vanguard Short-Term Investment-Grade | C41: VFSTX | D41: 40% | E41: 1.7%
B42: Vanguard Total Stock Mkt Idx | C42: VTSMX | D42: 15% | E42: -0.4%
B43: Vanguard Small Cap Value Index | C43: VISVX | D43: 10% | E43: 7.7%
B44: Vanguard Value Index | C44: VIVAX | D44: 10% | E44: -0.4%
B45: Vanguard Emerging Mkts Stock Idx | C45: VEIEX | D45: 5% | E45: -6.9%
B46: Vanguard European Stock Index | C46: VEURX | D46: 5% | E46: -16.0%
B47: Vanguard Pacific Stock Index | C47: VPACX | D47: 5% | E47: -4.8%
B48: Vanguard REIT Index | C48: VGSIX | D48: 5% | E48: 11.5%
B49: Vanguard Tax-Managed Small Cap Inv | C49: VTMSX | D49: 5% | E49: 6.7%
C50: TOTAL | D50: 100% | E50: 0.9%
A52: P8 | B52: William Bernstein’s Basic No-Brainer Portfolio
B53: Vanguard 500 Index | C53: VFINX | D53: 25% | E53: -1.5%
B54: Vanguard Tax-Managed Small Cap Inv | C54: VTMSX | D54: 25% | E54: 6.7%
B55: Vanguard Tax-Managed Intl | C55: VTMGX | D55: 25% | E55: -12.2%
B56: Vanguard Short-Term Bond Index | C56: VBISX | D56: 25% | E56: 1.7%
C57: TOTAL | D57: 100% | E57: -1.3%
A59: P9 | B59: Dilbert World’s Simplest
B60: Vanguard Total Intl Stock Index | C60: VTSMX | D60: 50% | E60: -0.4%
B61: Vanguard Short-Term Bond Index | C61: VEIEX | D61: 50% | E61: -6.9%
C62: TOTAL | D62: 100% | E62: -3.6%
A64: P10 | B64: Ted Aronson’s Lazy Portfolio
B65: Vanguard Emerging Mkts Stock Idx | C65: VEIEX | D65: 20% | E65: -6.9%
B66: Vanguard 500 Index | C66: VFINX | D66: 15% | E66: -1.5%
B67: Vanguard Pacific Stock Index | C67: VPACX | D67: 15% | E67: -4.8%
B68: Vanguard Extended Market Idx | C68: VEXMX | D68: 10% | E68: 5.7%
B69: Vanguard Inflation-Protected Secs | C69: VIPSX | D69: 10% | E69: 2.9%
B70: Vanguard European Stock Index | C70: VEURX | D70: 5% | E70: -16.0%
B71: Vanguard High-Yield Corporate | C71: VWEHX | D71: 5% | E71: 0.4%
B72: Vanguard Long-Term U.S. Treasury | C72: VUSTX | D72: 5% | E72: 7.3%
B73: Vanguard Small Cap Growth Index | C73: VISGX | D73: 5% | E73: 5.8%
B74: Vanguard Small Cap Value Index | C74: VISVX | D74: 5% | E74: 7.7%
B75: Vanguard Total Stock Mkt Idx | C75: VTSMX | D75: 5% | E75: -0.4%
C76: TOTAL | D76: 100% | E76: -1.2%
A78: P11 | B78: Bill Schultheis’ Coffeehouse Portfolio Vanguard
B79: Vanguard Total Bond Market Index | C79: VBMFX | D79: 40% | E79: 3.2%
B80: Vanguard 500 Index | C80: VFINX | D80: 10% | E80: -1.5%
B81: Vanguard Value Index | C81: VIVAX | D81: 10% | E81: -0.4%
B82: Vanguard Total Intl Stock Index | C82: VGTSX | D82: 10% | E82: -11.0%
B83: Vanguard REIT Index | C83: VGSIX | D83: 10% | E83: 11.5%
B84: Vanguard Small Cap Value Index | C84: VISVX | D84: 10% | E84: 7.7%
B85: Vanguard Small Cap Index | C85: NAESX | D85: 10% | E85: 6.7%
C86: TOTAL | D86: 100% | E86: 2.6%
A88: P12 | B88: FundAdvice Ultimate Buy & Hold
B89: Vanguard 500 Index | C89: VFINX | D89: 6.00% | E89: -1.5%
B90: Vanguard Value Index | C90: VIVAX | D90: 6.00% | E90: -0.4%
B91: Vanguard Small Cap Index | C91: NAESX | D91: 6.00% | E91: 6.7%
B92: Vanguard Small Cap Value Index | C92: VISVX | D92: 6% | E92: 7.7%
B93: Vanguard REIT Index | C93: VGSIX | D93: 6% | E93: 11.5%
B94: Vanguard Developed Markets Index | C94: VDMIX | D94: 12% | E94: -12.1%
B95: Vanguard Inflation-Protected Secs | C95: VIPSX | D95: 8% | E95: 2.9%
B96: Vanguard Interm-Term U.S. Treas | C96: VFITX | D96: 20% | E96: 4.1%
B97: Vanguard Short-Term Treasury | C97: VFISX | D97: 12% | E97: 1.4%
B98: Vanguard International Value | C98: VTRIX | D98: 12% | E98: -12.7%
B99: Vanguard Emerging Mkts Stock Idx | C99: VEIEX | D99: 6% | E99: -6.9%
C100: TOTAL | D100: 100.00% | E100: -0.7%
A102: P13 | B102: David Swensen’s Lazy Portfolio
B103: Vanguard Total Stock Mkt Idx | C103: VTSMX | D103: 30% | E103: -0.4%
B104: Vanguard REIT Index | C104: VGSIX | D104: 20% | E104: 11.5%
B105: Vanguard Developed Markets Index | C105: VDMIX | D105: 15% | E105: -12.1%
B106: Vanguard Emerging Mkts Stock Idx | C106: VEIEX | D106: 5% | E106: -6.9%
B107: Vanguard Inflation-Protected Secs | C107: VIPSX | D107: 15% | E107: 2.9%
B108: Vanguard Short-Term Treasury | C108: VFISX | D108: 15% | E108: 1.4%
C109: TOTAL | D109: 100% | E109: 0.7%
A111: P14 | B111: David Swensen’s Yale Endowment
B112: Vanguard Total Stock Mkt Idx | C112: VTSMX | D112: 30% | E112: -0.4%
B113: Vanguard REIT Index | C113: VGSIX | D113: 20% | E113: 11.5%
B114: Vanguard Developed Markets Index | C114: VDMIX | D114: 15% | E114: -12.1%
B115: Vanguard Emerging Mkts Stock Idx | C115: VEIEX | D115: 5% | E115: -6.9%
B116: Vanguard Inflation-Protected Secs | C116: VIPSX | D116: 15% | E116: 2.9%
B117: Vanguard Short-Term Treasury | C117: VUSTX | D117: 15% | E117: 7.3%
C118: TOTAL | D118: 100% | E118: 1.6%
A120: P15 | B120: MMM Do It Yourself Funds
B121: Vanguard 500 Index | C121: VFINX | D121: 12.00% | E121: -1.5%
B122: Vanguard Value Index | C122: VIVAX | D122: 12.00% | E122: -0.4%
B123: Vanguard Small Cap Value Index | C123: VISVX | D123: 20.00% | E123: 7.7%
B124: Bridgeway Ultra-Small Company Market | C124: BRSIX | D124: 20.00% | E124: 6.4%
B125: Vanguard REIT Index | C125: VGSIX | D125: 5.00% | E125: 11.5%
B126: Vanguard International Value | C126: VTRIX | D126: 9.00% | E126: -12.7%
B127: Vanguard International Explorer | C127: VGTSX | D127: 9.00% | E127: -11.0%
B128: Vanguard Emerging Mkts Stock Idx | C128: VEIEX | D128: 13.00% | E128: -6.9%
C129: TOTAL | D129: 100.00% | E129: 0.1%
A131: P16 | B131: Vanguard Windsor | C131: VWNDX | D131: 100.00% | E131: -1.5%
A133: P17 | B133: Scott Burns’ Couch Potato Portfolio
B134: Vanguard Total Stock Mkt Idx | C134: VTSMX | D134: 50% | E134: -0.4%
B135: Vanguard Inflation-Protected Secs | C135: VIPSX | D135: 50% | E135: 2.9%
C136: TOTAL | D136: 100% | E136: 1.3%
A138: P18 | B138: Scott Burns’ Margarita Portfolio
B139: Vanguard Total Stock Mkt Idx | C139: VTSMX | D139: 33.30% | E139: -0.4%
B140: Vanguard Inflation-Protected Secs | C140: VIPSX | D140: 33.30% | E140: 2.9%
B141: Vanguard Total Intl Stock Index | C141: VGTSX | D141: 33.30% | E141: -11.0%
C142: TOTAL | D142: 99.90% | E142: -2.9%
A144: P19 | B144: Scott Burns’ Four Square Portfolio
B145: Vanguard Total Stock Mkt Idx | C145: VTSMX | D145: 25% | E145: -0.4%
B146: Vanguard Inflation-Protected Secs | C146: VIPSX | D146: 25% | E146: 2.9%
B147: Vanguard Total Intl Stock Index | C147: VGTSX | D147: 25% | E147: -11.0%
B148: Vanguard REIT Index | C148: VGSIX | D148: 25% | E148: 11.5%
C149: TOTAL | D149: 100% | E149: 0.8%
A151: P20 | B151: Scott Burns’ Five Fold Portfolio
B152: Vanguard Total Stock Mkt Idx | C152: VTSMX | D152: 20% | E152: -0.4%
B153: Vanguard Inflation-Protected Secs | C153: VIPSX | D153: 20% | E153: 2.9%
B154: Vanguard Total Intl Stock Index | C154: VGTSX | D154: 20% | E154: -11.0%
B155: Vanguard REIT Index | C155: VGSIX | D155: 20% | E155: 11.5%
B156: American Century International Bd Inv | C156: BEGBX | D156: 20% | E156: -7.4%
C157: TOTAL | D157: 100% | E157: -0.9%
A159: P21 | B159: Scott Burns’ Six Ways from Sunday Portfolio
B160: Vanguard Total Stock Mkt Idx | C160: VTSMX | D160: 16.7% | E160: -0.4%
B161: Vanguard Inflation-Protected Secs | C161: VIPSX | D161: 16.7% | E161: 2.9%
B162: Vanguard Total Intl Stock Index | C162: VGTSX | D162: 16.7% | E162: -11.0%
B163: Vanguard REIT Index | C163: VGSIX | D163: 16.7% | E163: 11.5%
B164: American Century International Bd Inv | C164: BEGBX | D164: 16.7% | E164: -7.4%
B165: Vanguard Energy | C165: VGENX | D165: 16.7% | E165: -9.2%
C166: TOTAL | D166: 100.0% | E166: -2.3%
A168: P22 | B168: Larry Swedroe Simple
B169: Vanguard Value Index | C169: VIVAX | D169: 15% | E169: -0.4%
B170: Vanguard Small Cap Value Index | C170: VISVX | D170: 15% | E170: 7.7%
B171: Vanguard Small Cap Index | C171: NAESX | D171: 13% | E171: 6.7%
B172: Vanguard Emerging Mkts Stock Idx | C172: VEIEX | D172: 4% | E172: -6.9%
B173: Vanguard International Value Inv | C173: VTRIX | D173: 13% | E173: -12.7%
B174: Vanguard Inflation-Protected Secs | C174: VIPSX | D174: 40% | E174: 2.9%
C175: TOTAL | D175: 100% | E175: 1.2%
A177: P23 | B177: Larry Swedroe Min Fat Tails
B178: Vanguard Small Cap Value Index | C178: VISVX | D178: 15% | E178: 7.7%
B179: Vanguard Emerging Mkts Stock Idx | C179: VEIEX | D179: 15% | E179: -6.9%
B180: Vanguard Inflation-Protected Secs | C180: VIPSX | D180: 35% | E180: 2.9%
B181: Vanguard Short-Term Treasury | C181: VFISX | D181: 35% | E181: 1.4%
C182: TOTAL | D182: 100% | E182: 1.6%
A184: P24 | B184: IFA Index Portfolio 100 Bright Red
B185: DFA U.S. Large Company | C185: DFLCX | D185: 12% | E185: 0.0%
B186: DFA U.S. Large Cap Value | C186: DFLVX | D186: 12% | E186: 3.8%
B187: DFA U.S. Micro Cap | C187: DFSCX | D187: 20% | E187: 8.7%
B188: DFA U.S. Small Cap Value | C188: DFSVX | D188: 20% | E188: 9.0%
B189: DFA Real Estate Securities | C189: DFREX | D189: 5% | E189: 11.7%
B190: DFA Intl Value | C190: DFIVX | D190: 6% | E190: -11.6%
B191: DFA Intl Small Company | C191: DFISX | D191: 6% | E191: -5.7%
B192: DFA Intl Small Cap Value | C192: DISVX | D192: 6% | E192: -8.0%
B193: DFA Emerging Markets | C193: DFEMX | D193: 4% | E193: -5.5%
B194: DFA Emerging Markets Value | C194: DFEVX | D194: 4% | E194: -6.8%
B195: DFA Emerging Markets Small Cap | C195: DEMSX | D195: 5% | E195: -3.6%
C196: TOTAL | D196: 100% | E196: 1.32%*
A198: P25 | B198: IFA Index Portfolio 50
B199: DFA U.S. Large Company | C199: DFLCX | D199: 12% | E199: 0.0%
B200: DFA U.S. Large Cap Value | C200: DFLVX | D200: 12% | E200: 3.8%
B201: DFA U.S. Micro Cap | C201: DFSCX | D201: 6% | E201: 8.7%
B202: DFA U.S. Small Cap Value | C202: DFSVX | D202: 6% | E202: 9.0%
B203: DFA Real Estate Securities | C203: DFREX | D203: 6% | E203: 11.7%
B204: DFA Intl Value | C204: DFIVX | D204: 6% | E204: -11.6%
B205: DFA Intl Small Company | C205: DFISX | D205: 3% | E205: -5.7%
B206: DFA Intl Small Cap Value | C206: DISVX | D206: 3% | E206: -8.0%
B207: DFA Emerging Markets | C207: DFEMX | D207: 2% | E207: -5.5%
B208: DFA Emerging Markets Value | C208: DFEVX | D208: 2% | E208: -6.8%
B209: DFA Emerging Markets Small Cap | C209: DEMSX | D209: 2% | E209: -3.6%
B210: DFA One-Year Fixed-Income I | C210: DFIHX | D210: 10% | E210: 0.4%
B211: DFA Two-Year Global Fixed-Income I | C211: DFGFX | D211: 10% | E211: 0.8%
B212: DFA Five-Year Government I | C212: DFFGX | D212: 10% | E212: 2.3%
B213: DFA Five-Year Global Fixed-Income I | C213: DFGBX | D213: 10% | E213: 3.2%
C214: TOTAL | D214: 100% | E214: 0.36%*